{"$schema":"https://json-schema.org/draft/2020-12/schema","$id":"https://axm.tools/schemas/deep-tech-successor-event-v1.json","title":"AXM Deep-Tech Successor Event","type":"object","additionalProperties":false,"required":["schema","event_id","target_id","event_class","observed_at","source_refs","affected_object_ids","materiality","proposed_changes","nonclaims","terminal_action"],"properties":{"schema":{"const":"axm/deep-tech-successor-event@1"},"event_id":{"type":"string"},"event_class":{"enum":["financing","leadership_or_authority","technical_test","partnership_or_integration","customer_or_procurement","legal_or_registry","technical_publication","claim_correction","security_or_export"]},"observed_at":{"type":"string"},"source_refs":{"type":"array","minItems":1,"items":{"type":"string"}},"affected_object_ids":{"type":"array","items":{"type":"string"}},"materiality":{"enum":["none","low","medium","high","critical"]},"proposed_changes":{"type":"array","items":{"type":"object","required":["object_id","from_state","to_state","basis"],"properties":{"object_id":{"type":"string"},"from_state":{"type":"string"},"to_state":{"type":"string"},"basis":{"type":"string"}},"additionalProperties":true}},"nonclaims":{"type":"array","items":{"type":"string"}},"terminal_action":{"enum":["NO_DELTA","CREATE_SUCCESSOR","HOLD_FOR_EVIDENCE","CORRECT_INGESTION","ESCALATE_AUTHORITY"]},"target_id":{"type":"string","minLength":1}}}
