{"schema":"axm/deep-tech-successor-event@1","event_id":"EVT-SYN-001","target_id":"SYNTHETIC-NMR-001","event_class":"technical_test","observed_at":"2026-09-08","source_refs":["SRC-003"],"affected_object_ids":["CLM-002"],"materiality":"high","proposed_changes":[{"object_id":"CLM-002","from_state":"HELD","to_state":"CORROBORATED","basis":"Synthetic independent lab publishes repeated open-water runs against declared acceptance criteria."}],"nonclaims":["Does not establish customer acceptance.","Does not establish production readiness or operational deployment."],"terminal_action":"CREATE_SUCCESSOR"}
